<?xml version="1.0" encoding="UTF-8" ?>

<lexemes xmlns:xsi="http://www.w3.org/2001/XMLSchema-instance"
	xsi:noNamespaceSchemaLocation="lexemes.xsd">
	<lexeme>
		<lang>eng</lang>
		<form>broθor</form>
	</lexeme>

	<lexeme>
		<lang>rus</lang>
		<form>brat</form>
	</lexeme>
	
	<lexeme>
		<lang>got</lang>
		<form>broθar</form>
	</lexeme>

	<lexeme>
		<lang>grc</lang>
		<form>ɸrater</form>
	</lexeme>
	
	<lexeme>
		<lang>lat</lang>
		<form>frater</form>
	</lexeme>
	
	<lexeme>
		<lang>ave</lang>
		<form>bratar</form>
	</lexeme>
	
	<lexeme>
		<lang>non</lang>
		<form>broðir</form>
	</lexeme>
	
	<lexeme>
		<lang>xto</lang>
		<form>praçar</form>
	</lexeme>
	
	<lexeme>
		<lang>txb</lang>
		<form>proçer</form>
	</lexeme>
	
	<lexeme>
		<lang>sga</lang>
		<form>braθar</form>
	</lexeme>
	
	<lexeme>
		<lang>xpg</lang>
		<form>bratere</form>
	</lexeme>
</lexemes>